{
  "$id": "https://schemas.take-two-options.invalid/v11.1/opra_provider_readiness.schema.json",
  "$schema": "https://json-schema.org/draft/2020-12/schema",
  "additionalProperties": false,
  "properties": {
    "assessment_scope": {
      "const": "offline_configuration_only",
      "default": "offline_configuration_only",
      "title": "Assessment Scope",
      "type": "string"
    },
    "authentication_mode": {
      "anyOf": [
        {
          "enum": [
            "tws_session",
            "api_credentials"
          ],
          "type": "string"
        },
        {
          "type": "null"
        }
      ],
      "title": "Authentication Mode"
    },
    "configuration_errors": {
      "items": {
        "type": "string"
      },
      "title": "Configuration Errors",
      "type": "array"
    },
    "connection_attempted": {
      "const": false,
      "default": false,
      "title": "Connection Attempted",
      "type": "boolean"
    },
    "credentials_present": {
      "title": "Credentials Present",
      "type": "boolean"
    },
    "credentials_required": {
      "title": "Credentials Required",
      "type": "boolean"
    },
    "entitlement_confirmed": {
      "title": "Entitlement Confirmed",
      "type": "boolean"
    },
    "exact_command": {
      "const": "ttwo-options pre-opra-finalize --config configs/pre_opra/v1/ttwo_research.yaml",
      "default": "ttwo-options pre-opra-finalize --config configs/pre_opra/v1/ttwo_research.yaml",
      "title": "Exact Command",
      "type": "string"
    },
    "license_reviewed": {
      "title": "License Reviewed",
      "type": "boolean"
    },
    "missing_variables": {
      "items": {
        "type": "string"
      },
      "title": "Missing Variables",
      "type": "array"
    },
    "notes": {
      "items": {
        "type": "string"
      },
      "title": "Notes",
      "type": "array"
    },
    "order_capability": {
      "const": "forbidden",
      "default": "forbidden",
      "title": "Order Capability",
      "type": "string"
    },
    "paper_decision_contract": {
      "const": "PaperDecisionRecord",
      "default": "PaperDecisionRecord",
      "title": "Paper Decision Contract",
      "type": "string"
    },
    "paper_realization_contract": {
      "const": "PaperRealizationRecord",
      "default": "PaperRealizationRecord",
      "title": "Paper Realization Contract",
      "type": "string"
    },
    "phase_m_started": {
      "const": false,
      "default": false,
      "title": "Phase M Started",
      "type": "boolean"
    },
    "provider": {
      "anyOf": [
        {
          "type": "string"
        },
        {
          "type": "null"
        }
      ],
      "title": "Provider"
    },
    "provider_protocol": {
      "const": "LiveOptionMarketDataProvider",
      "default": "LiveOptionMarketDataProvider",
      "title": "Provider Protocol",
      "type": "string"
    },
    "read_only": {
      "const": true,
      "default": true,
      "title": "Read Only",
      "type": "boolean"
    },
    "required_variables": {
      "items": {
        "type": "string"
      },
      "title": "Required Variables",
      "type": "array"
    },
    "schema_version": {
      "const": "1.1",
      "default": "1.1",
      "title": "Schema Version",
      "type": "string"
    },
    "status": {
      "enum": [
        "ADAPTER_READY_NOT_CONNECTED",
        "CONFIGURED_NOT_ENTITLED",
        "MISSING_CONFIGURATION"
      ],
      "title": "Status",
      "type": "string"
    },
    "transmit": {
      "const": false,
      "default": false,
      "title": "Transmit",
      "type": "boolean"
    },
    "what_if": {
      "const": true,
      "default": true,
      "title": "What If",
      "type": "boolean"
    }
  },
  "required": [
    "status",
    "provider",
    "authentication_mode",
    "required_variables",
    "missing_variables",
    "configuration_errors",
    "credentials_required",
    "credentials_present",
    "entitlement_confirmed",
    "license_reviewed",
    "notes"
  ],
  "title": "ProviderReadinessReport",
  "type": "object"
}
